SainzTiebauzfu	Sainz Tiebauz fu
faidemiel;PorDeunelvoltilobserver.Cielne	fai de miel ; Por Deu nel volt il observer . Ciel ne
fudnezdemedreviusQuitalexercitevidist.AdOstedun,acilla	fud nez de medre vius Qui tal exercite vidist . Ad Ostedun , a cilla
ciu,DomsanctLethgiervaiasalir.	ciu , Dom sanct Lethgier vai asalir .
Nepotintrerenlaciutat	Ne pot intrer en la ciutat
;Deforslasist,fistigranmiel.	; Defors l  asist , fist i gran miel .
EtsanczLethgiersmulenfud	Et sancz Lethgiers mul en fud
trists,Por	trists , Por
cieltielmielquaedeforsvid.Sosclerjespresilrevestiz,Etobsescroixforssenexit	ciel tiel miel quae defors vid . Sos clerjes pres il revestiz , Et ob ses croix fors s  en exit
.Porronexit,vollipreierQuaetotcielmiellaissesporDeu.CielEwruins	. Porron exit , vol li preier Quae tot ciel miel laisses por Deu . Ciel Ewruins
,qualhoralvid,Penrelrovat,lierlofist.HORENAUREZLASPOENASgranz,Quae	, qual horal vid , Penrel rovat , lier lo fist . HOR EN AUREZ LAS POENAS granz , Quae
ilenfisdra,litiranz.Liperfidestamfudcruels,Lisolsdelcaplifaicrever.Cumsi	il en fisdra , li tiranz . Li perfides tam fud cruels , Lis ols del cap li fai crever . Cum si
lautfait,mislenreclus;Ne	l  aut fait , mis l  en reclus ; Ne
sothnulsom	soth nuls om
quesdevenguz.AmlaslawraslifaitalierHanclalinguaquaeautinquev.	qu  es devenguz . Am las lawras li fai talier Hanc la lingua quae aut in quev .
Cumsilauttothvituperet,DistEwruins,quitanfudmiels:"Horaperduddondeuparlier;Ja	Cum si l  aut toth vituperet , Dist Ewruins , qui tan fud miels :" Hor a perdud don deu parlier ; Ja
nonpodramaisDeulaudier."Aterrajoth,multfoafflicz;	non podra mais Deu laudier ." A terra joth , mult fo afflicz ;
Nonoctobsecuiencalsist.Superlispieznepodester,Quetozlosatilcondemnets.	Non oct ob se cui en calsist . Super lis piez ne pod ester , Que toz los at il condemnets .
Oraperduddondeuparlier;Janonpodra	Or a perdud don deu parlier ; Ja non podra
maisDeulaudier.Sedilnon	mais Deu laudier . Sed il non
adlinguaparlier,Deusexaudislissospensaez;Etsiel	ad lingu  a parlier , Deus exaudis lis sos pensaez ; Et si el
nonadolscarnels,En	non ad ols carnels , En
corlosadespiritiels;Etsiencorpsagrandtorment,Lanimanawraconsolament.Guenesothnumcuil	cor los ad espiritiels ; Et si en corps a grand torment , L  animan awra consolament . Guenes oth num cuil
comandat;Lajus	comandat ; La jus
encartreslenmenat;EtenFescant,in	en cartres l  en menat ; Et en Fescant , in
cielmonstier,IlloreclusdrentsanctLethgier.DomineDeus	ciel monstier , Illo reclusdrent sanct Lethgier . Domine Deus
incielflaielIvisitetLethgier	in ciel flaiel I visitet Lethgier
sonserw.Lalabialiadrestaurat,SicumdesanzDeupreslaudier;Ethancenautmercisigrand	son serw . La labia li ad restaurat , Si cum desanz Deu pres laudier ; Et hanc en aut merci si grand
,Parlierlofistsicumdesanz.DoncpresLethgiersapreier,	, Parlier lo fist si cum desanz . Donc pres Lethgiers a preier ,
PoblebenfistcredreinDeu.Et	Poble ben fist credre in Deu . Et
Ewruis,cumillaudit,Credrenelpotantroquelvid.Cumillovid,fudcorroptios;	Ewruis , cum il l  audit , Credre nel pot antro quel vid . Cum il lo vid , fud corroptios ;
Doncoctablui	Donc oct ab lui
duresraizons.Elcorsexastraaltirant,Peislipromestadenavant.Agrandfuror,agranflaiel,	dures raizons . El cors exastra al tirant , Peis li promest ad en avant . A grand furor , a gran flaiel ,
SilrecomandaLaudebert	Sil recomanda Laudebert
.Ciolirova,etnoitetdiMiellifesistdontrequelviu	. Cio li rova , et noit et di Miel li fesist dontre qu  el viu
.CielLaudeberzfurabuonsom,EtsanctLethgierduisasondom.Illivolfairemultamet;Bewre	. Ciel Laudeberz fura buons om , Et sanct Lethgier duis a son dom . Il li vol faire mult amet ; Bewre
lirovaaporter.Garda,sividgrandclaritet;Decelvindre,fud	li rova aporter . Garda , si vid grand claritet ; De cel vindre , fud
deparDeu.Sicumroors	de par Deu . Si cum roors
incelesgranz,Etsicumflammesclarardanz.CilLaudeberz,qualhoralvid	in cel es granz , Et si cum flammes clar ardanz . Cil Laudeberz , qual horal vid
,Tornes	, Torne s 
alsaltres,silordist:"CiestomnetielmultaimaDeus	als altres , si lor dist :" Ciest omne tiel mult aima Deus
,Porcuitelscausavindeciel."Porciels	, Por cui tels causa vin de ciel ." Por ciels
signesquevidrenttels,Deupresdrentmultaconlauder.Tuitliomnedecielpais	signes que vidrent tels , Deu presdrent mult a conlauder . Tuit li omne de ciel pais
,Trestuitapresdrentavenir;EtsanczLethgierslisprediat	, Trestuit apresdrent a venir ; Et sancz Lethgiers lis prediat
,DomineDeuilleslucrat.RendetcielfruitespiritielQuaeDeusliauretperdonat.	, Domine Deu il les lucrat . Rendet ciel fruit espiritiel Quae Deus li auret perdonat .
EtEwruins,cumillaudit,Credrenelpotantroquelvid.Cilbiensquelfist,	Et Ewruins , cum il l  audit , Credre nel pot antro quel vid . Cil biens qu  el fist ,
cillipesat	cil li pesat
;Occiderelocommandat.QuatromnesitramistarmezQueluialessuntdecoller.	; Occidere lo commandat . Quatr  omnes i tramist armez Que lui alessunt decoller .
LitresvindrentasanctLethgier,Jussegiterentasospez.Delor	Li tres vindrent a sanct Lethgier , Jus se giterent a sos pez . De lor
pechietzqueaurentfaizIllosabsolsetperdonet.Lo	pechietz que aurent faiz Il los absols et perdonet . Lo
quarz,unsfel,nomaVadart,Abuninspiethlodecollat.Etcumill	quarz , uns fel , nom a Vadart , Ab un inspieth lo decollat . Et cum il l 
audtollutloquev,Locorpsesterasobrelspiez.	aud tollut lo quev , Lo corps estera sobrels piez .
Ciofudlonxdisquenoncadit;Laisaprosmatqueluifirid.Entrol	Cio fud lonx dis que non cadit ; Lai s  aprosmat que lui firid . Entrol
talialospezdejus,Locorpsesterasempre	talia los pez dejus , Lo corps estera sempre
sus.Delcorpsasazl	sus . Del corps asaz l 
avezaudit,Etdelsflaielsquegranzsustint.LanimareciutDomineDeus;	avez audit , Et dels flaiels que granz sustint . L  anima reciut Domine Deus ;
Alsaltres	Als altres
sanzenvaiencel.IlnosaiudobcielSenior	sanz en vai en cel . Il nos aiud ob ciel Senior
Porcuisustinctelspassions	Por cui sustinc tels passions
