SainzTiebauzfu	Sainz Tiebauz fu
Jesus,filsDeu,estil."Tuepslasdeit"responJesus.Tuitli	Jesus , fils Deu , est il ." Tu eps l  as deit " respon Jesus . Tuit li
felloncridentadun:"Maiorforsfaitqueiquerem?Perluimedepsaudit	fellon crident adun :" Maior forsfait que i querem ? Per lui medeps audit
lavem."Losossansolsduncquescubrirent,acolejarfellonloprisdrent;ensobretot	l  avem ." Losos sans ols duncques cubrirent , a colejar fellon lo prisdrent ; ensobre tot
silescarnissent:"Dinos,prophete,chitofisdret?"Forsenlasestrasestet	si l  escarnissent :" Di nos , prophete , chi t  o fisdret ?" Fors en las estras estet
Petre;alfogluseire	Petre ; al fog l  useire
laeswardevet.Desaraisonsi	l  aeswardevet . De sa raison si
lesfrededqueloDeufillifaineier.Anzquaelanoitlojalzcantes,tercevezPetre	l  esfreded que lo Deu fil li fai neier . Anz quae la noit lo jalz cantes , terce vez Petre
loneiez.Jesuslibonsloreswardet,lui	lo neiez . Jesus li bons lo reswardet , lui
recognostrelsemperfiz.Petrusdaloforssenaled,amaramentmultseploret,per	recognostrel semper fiz . Petrus d  alo fors s  en aled , amarament mult se ploret , per
ciolaissedDeusse	cio laissed Deus se
neier;quedenosaietpieted|Cumlematinsfudesclairez,davantPilatlenantmenet;fortment	neier ; que de nos aiet pieted | Cum le matins fud esclairez , davant Pilat l  en ant menet ; fortment
lovantilacusand,lasoamortmultdemandant.PilazErodl	lo vant il acusand , la soa mort mult demandant . Pilaz Erod l 
enenviet,cuidesabanzvoliet	en enviet , cui desabanz voliet
mel;deJesuChristipassionamsepaierentacieljorn.LofelHerodescumlo	mel ; de Jesu Christi passion am se paierent a ciel jorn . Lo fel Herodes cum lo
vid,multlezsemperenesdevint.Deluilongtempsmultaaudit,semperpensedvertuzfeisis.Demultesvises	vid , mult lez semper en esdevint . De lui long temps mult a audit , semper pensed vertuz feisis . De multes vises
lapeled,Jesuslibonsmotnolsoned.Judeulacusent,elsetais;adunrespondrenon	l  apeled , Jesus li bons mot nol soned . Judeu l  acusent , el se tais ; ad un respondre non
denat.Dunclodespeisel	denat . Dunc lo despeis e l 
escarnitlifelHerodesencel	escarnit li fel Herodes en cel
di;blancvestimentsilavestit,fellonPiladloretramist.Pilazqueanzlenvollaiser,	di ; blanc vestiment si l  a vestit , fellon Pilad lo retramist . Pilaz que anz l  en vol laiser ,
nolconsentuntfellunJudeu.Vidaperdonentalladrun."	nol consentunt fellun Judeu . Vida perdonent al ladrun ."
Aucid,aucid-crident-	Aucid , aucid - crident -
Jesum|"Barrabantperdonentlavide,Jesuminaltacruzclaufisdrent."Crucifige,crucifige|"cridentPilattrestuitensems."Cumaucidraieu	Jesum |" Barrabant perdonent la vide , Jesum in alta cruz claufisdrent ." Crucifige , crucifige |" crident Pilat trestuit ensems ." Cum aucidrai eu
vostrerei?-zodisPilaz	vostre rei ?- zo dis Pilaz
-forsfaiz	- forsfaiz
nones;rumprelfaraietflagellar,poisseslaisarail	non es ; rumprel farai et flagellar , poisses laisarai l
enannar	 en annar
."Ensemscridenttuitlifelluntentroencelenvanlasvoz:"SitulaisesviureJesum,non	." Ensems crident tuit li fellunt entro en cel en van las voz :" Si tu laises viure Jesum , non
esamicslemperador."Pilazsasmans	es amics l  emperador ." Pilaz sas mans
dunqueslaved,quedesamortposchesneger.EnsemscridenttuitliJudeu:"Sobrenossiatozli	dunques laved , que de sa mort posches neger . Ensems crident tuit li Judeu :" Sobre nos sia toz li
pechez|"Pilazcumaudidtalsraisons,	pechez |" Pilaz cum audid tals raisons ,
jalorgurpisnostresennior;donc	ja lor gurpis nostre sennior ; donc
lorecebentlifellun,forslenconducentenlacort.Depurpuredonclovestirenteten	lo recebent li fellun , fors l  en conducent en la cort . De purpure donc lo vestirent et en
samanunrauslimisdrent;coronaprendentdelasespinesetenson	sa man un raus li misdrent ; corona prendent de las espines et en son
cabfellunlasisdrent,Dedavantluituitagenolzsis	cab fellun l  asisdrent , De davant lui tuit a genolz si s 
excrebantentlifellon;dunclosaludentcumsenior	excrebantent li fellon ; dunc lo saludent cum senior
etadescarnemperador	et ad escarn emperador
.Etcumasez	. Et cum asez
lontescarnid,dunclivestentsonvestiment,etelmedepssipres	l  ont escarnid , dunc li vestent son vestiment , et el medeps si pres
sacruz,avantozvaiapasiun.Femnesluivandetrasseguanploranlovanetgaimentan	sa cruz , avan toz vai a pasiun . Femnes lui van detras seguan ploran lo van et gaimentan
.Jesuslipiusredregarder,ab	. Jesus li pius redre garder , ab
lesfemnespresaparler."Audez,filliesJerusalem;permenonvosestobsplorer;maispervoset	les femnes pres a parler ." Audez , fillies Jerusalem ; per me non vos est obs plorer ; mais per vos et
pervostresfilzplorezassaz,quiobsvoses."CumelpervengaGolgota,davanlaporta	per vostres filz plorez assaz , qu  i obs vos es ." Cum el perveng a Golgota , davan la porta
delaciptat,dunc	de la ciptat , dunc
lorgurpitsoechamisaechisenscusturaefofaitice.Ilnol	lor gurpit soe chamisae chi sens custurae fo faitice . Il no l
auserenderamar,maischilaura,sortangitad;nonfut	 auseren deramar , mais chi l  aura , sort an gitad ; non fut
partizsosvestimenz,zofugranzsignatotperver.En	partiz sos vestimenz , zo fu granz signa tot per ver . En
hunafet,hunavertettuitsoifideldeventester;lososregnaznonesdevis,	huna fet , huna vertet tuit soi fidel devent ester ; lo sos regnaz non es devis ,
encaritadtozesuniz.Edelsfelunsqueuvosdisanz,lai	en caritad toz es uniz . E dels feluns qu  eu vos dis anz , lai
deiveniroeulaisai;quarillofelmesclenabvin,nostraesenior	dei venir o eu laisai ; quar il lo fel mesclen ab vin , nostrae senior
lotenden	lo tenden
il.Cuml	il . Cum l 
anlevadsusenlacruz,dosasoslazpendenlasruns:entrecelsdospendentJesum.Ilperescarno	an levad sus en la cruz , dos a sos laz penden lasruns : entre cels dos pendent Jesum . Il per escarn o
fantrestot.Cumillanmessusenlacruz,granfanescarn	fan trestot . Cum il l  an mes sus en la cruz , gran fan escarn
,grancridaizun;ensobretozunsdelsladruns	, gran cridaizun ; ensobre toz uns dels ladruns
,elescarniereiJesum.Respondetlaltre:"Malidiz	, el escarnie rei Jesum . Respondet l  altre :" Mal i diz
.Elmoratort	. El mor a tort
,rennonforsfist;maisnosadreitpercolpasgranzesmesoidiencestahanz."	, ren non forsfist ; mais nos a dreit per colpas granz esmes oidi en cest ahanz ."
EnversJesumsosolztorned,sipiamentluiappelled:"Demetmembrespertamercet,cutu	Envers Jesum sos olz torned , si piament lui appelled :" De met membres per ta mercet , cu tu
vendras,Crist,entonren."	vendras , Crist , en ton ren ."
Responli	Respon li
bonsquinonmentid,chienepsamortsemperfupius:"	bons qui non mentid , chi en epsa mort semper fu pius :"
Eutopromet,oiencestdi	Eu t  o promet , oi en cest di
abmevenrasinparadis."ODeus,versrex,JesuCrist,cital	ab me venras in paradis ." O Deus , vers rex , Jesu Crist , ci tal
donfaispertamercit,chiperhunaconfessionvideperdonesalladrun,nostelaudametnoitedi	don fais per ta mercit , chi per huna confession vide perdones al ladrun , nos te laudam et noit e di
,denosaies	, de nos aies
veramercit	vera mercit
;tunosperdone	; tu nos perdone
celzpecazquenosvetdesttuapietad.Jusquenonadeslomeiditrestotcestmundgranznoizcubrid;fui	celz pecaz qu  e nos vetdest tua pietad . Jusque nona des lo meidi trestot cest mund granz noiz cubrid ; fui
losolelzetfuilaluna,postqueDeuffilzsuspensusfure.Adepsanonacumperving,	lo solelz et fui la luna , post que Deuffilz suspensus fure . Ad epsa nona cum perving ,
duncescridedJesusgranz	dunc escrided Jesus granz
criz.Hebraicefortment	criz . Hebraice fortment
lodis:"Heli,Heli,perquemgulpist?"Unsdelsfellunschistaiki,	lo dis :" Heli , Heli , per quem gulpist ?" Uns dels felluns chi  sta iki ,
susenlacruzlitenlazit.Jesusfortmenduncrecridet	sus en la cruz li ten l  azit . Jesus fortmen dunc recridet
;lespiritusde	; le spiritus de
luianet.Cumde	lui anet . Cum de
Jesulanmananet,tanduramentterracrollet,rochesfendient	Jesu l  anma  n anet , tan durament terra crollet , roches fendient
,chedentmunt,sepulcrasanzobrirentmult.Et	, chedent munt , sepulcra sanz obrirent mult . Et
multcorpssanzensunexutetinteromnessuntvedud;quiintemplumDeicortinepend,juschelaterrapermei	mult corps sanz en sun exut et inter omnes sunt vedud ; qui in templum Dei cortine pend , jusche la terra per mei
fend.Delazlacrozestet	fend . De laz la croz estet
MariaedecuiJesus	Mariae de cui Jesus
veracarnprisdret;cumcelacarnvidramurir,qualagredol,nol	vera carn prisdret ; cum cela carn vidra murir , qual agre dol , nol
sabomvius.Elamoltbensabremembrardesoacarn	sab om vius . Ela molt ben sab remembrar de soa carn
cumDeusfunaz.Jalvedeselasimorir,elresurdra,chosabperver.Maisnemperro	cum Deus fu naz . Jal vedes ela si morir , el resurdra , cho sab per ver . Mais nemperro
granzfulidols,chitraversetperlosoncor;nulzom	granz fu li dols , chi traverset per lo son cor ; nulz om
mortalznolpodpenser,sanzSymeonzloipercogded.JosepsPilatmultapreiatlocorpsJesuquellidones;a	mortalz nol pod penser , sanz Symeonz loi percogded . Joseps Pilat mult a preiat lo corps Jesu qu  el li dones ; a
grandhonorellenportet,ensoschamsilslenvolopet.Nicodemusdellaltrapartmultunguement	grand honor el l  en portet , en sos chamsils l  envolopet . Nicodemus dell  altra part mult unguement
hiaportat;entermirraetaloenquasicentliurasadoned.Agrandhonordecespimenclaromatizencuschement	hi aportat ; enter mirra et aloen quasi cent liuras a doned . A grand honor de ces pimenc l  aromatizen cuschement
.Dunclopausenelmonumentocorpsnonjagancaceltemps.Lasoamadrevirgofuetsen	. Dunc lo pausen el monument o corps non jag anc a cel temps . La soa madre virgo fu et sen
pechedsiportetlui.Sosmunumentfuretoznous,anzluinoijagunquenulzom.	peched si portet lui . Sos munument fure toz nous , anz lui noi jag unque nulz om .
Nonfudassazancalsfelluns;davantPilattrestuitenvont:"Nostepraeiam,pertamercetgardesimet,non	Non fud assaz anc als felluns ; davant Pilat trestuit en vont :" Nos te praeiam , per ta mercet gardes i met , non
siaemblez.Quarelzodisqueresurdraetalterzdiviuspareistra;emblarlauran	sia emblez . Quar el zo dis que resurdra et al terz di vius pareistra ; emblar l  auran
lisoifidel	li soi fidel
,atozdiranquerevisquet.Granzenavemaguderrors,orenaurempecemaiors."Armazvassalzdunc	, a toz diran que revisquet . Granz en avem agud errors , or en aurem pece maiors ." Armaz vassalz dunc
lorliuret,lomonumentlorcomandet.ChristusJesus,quiDeusesversquisemperfuetsemperer,	lor liuret , lo monument lor comandet . Christus Jesus , qui Deus es vers qui semper fu et semper er ,
jafoslacharnsdeluiaucise,regnetperocumanzsefisdret.	ja fos la charns de lui aucise , regnet pero cum anz se fisdret .
Quaelenfernduncasalit,fortSatananalovenquit;persoamortsilavencut	Qua el  enfern dunc asalit , fort Satanan alo venquit ; per soa mort si l  a vencut
quecontraomnenonavertud.Etquieraliomprimerselsoienffantpersonpechet;eli	que contra omne non a vertud . Etqui era li om primers el soi enffant per son pechet ; e li
petiteteligranetquiesteventpermulzanz	petitet e li gran etqui estevent per mulz anz
.Quarancnonfonulomcarnals,encelenfernnonfosanaz,usquevenguesqui,senspechet,pertozsolses	. Quar anc non fo nulom carnals , en cel enfern non fos anaz , usque vengues qui , sens pechet , per toz solses
comunalei.Argentneaurnonidonatmasquesonsang	comuna lei . Argent ne aur non i donat mas que son sang
etsoacarn;degcelenferntozlosliuret,enparadislosarberget.Etalterzdilomattinclar	et soa carn ; d  eg cel enfern toz los liuret , en paradis los arberget . Et al terz di lo mattin clar
,cumlisoleilzfoesclairaz,tresfemnesvanalmonument;moltcarsportaventunguemenz.Langeles	, cum li soleilz fo esclairaz , tres femnes van al monument ; molt cars portavent unguemenz . L  angeles
Deudeceldessendsisaproismetalmonument;tal	Deu de cel dessend si s  aproismet al monument ; tal
aregardcumfocsardenzetcumlaneusblancvestimenz.Enpasquelvidrenli	a regard cum focs ardenz et cum la neus blanc vestimenz . En pas quel vidren li
custod,sisespaurirendepavor,quequaissesmorzaterravengrendegranpavorquesoblelz	custod , si s  espauriren de pavor , que quaisses morz a terra vengren de gran pavor que sobl  elz
vengre.Sus	vengre . Sus
enlapeddrelangelsist	en la peddre l  angel sist
,siparletalasfemnes,dis:"Nossneient	, si parlet a las femnes , dis :" Nos  s neient
ciperquecrement,queJesumCristbenrequeret.Anazenesetnonesci,totacomplit	ci per que crement , que Jesum Crist ben requeret . Anaz en es et non es ci , tot a complit
quunquevosdis.Venezvederlolocvoiantolisoscorpsjacdesabanz.	quun que vos dis . Venez veder lo loc voiant o li sos corps jac desabanz .
Asosfidelstotannuncaz,	A sos fidels tot annuncaz ,
masvosPetdrunnoioblidez:en	mas vos Petdrun noi oblidez : en
Galileaavantenvai,allolvetran	Galilea avant en vai , allol vetran
oditlorad."Ellesdequicumsunttornades,Jesuslasasenprencontradas;duncreconnossentlosenior	o dit lor ad ." Elles d  equi cum sunt tornades , Jesus las a senpr  encontradas ; dunc reconnossent lo senior
,siladorentcumredemptor.Lonostraeseindraeeneps	, si l  adorent cum redemptor . Lo nostrae seindrae en eps
celdiveduzfuraeveiadescinc.PrimeralvitsanctaMariae,decuisepdiables	cel di veduz furae veiades cinc . Primeral vit sancta Mariae , de cui sepdiables
forsmisdret.Empreslovidrencellesduaes	forsmisdret . Empres lo vidren celles duaes
delmunument,cumseretornent	del munument , cum se retornent
.Petdreslovitenepscel	. Petdres lo vit en eps cel
di,abluiparletsilconjaudit.Enverslovespraeenversloserdunclorevidrendoifidel;castelEmausabelzentret	di , ab lui parlet sil conjaudit . Envers lo vesprae envers lo ser dunc lo revidren doi fidel ; castel Emaus ab elz entret
,abelzensemblesisopet.	, ab elz ensemble si sopet .
Jasadunentlisoifidel,jadicentuitqueviuseret;cumilmenaventalraizon,	Ja s  adunent li soi fidel , ja dicen tuit que vius eret ; cum il menaven tal raizon ,
Jesusestetenmettrestoz."Paxvobissit	Jesus estet en mettrestoz ." Pax vobis sit
-disatrestoz-eusoiJesusquipassussoi;vedezmasmans,vedez	- dis a trestoz - eu soi Jesus qui passus soi ; vedez mas mans , vedez
mospeds,vedezmolaz,quifuiplages."Fortmentsunilespaventat,illinoncredentqueaiacarn	mos peds , vedez mo laz , qu  i fui plages ." Fortment sun il espaventat , il li non credent que aia carn
;zopensentil,queenterelzlespiritusaparegues.Melepeisonequimanget,enveritad	; zo pensent il , que enter elz le spiritus aparegues . Mel e peison equi manget , en veritad
losconfirmet;sapassionpeisonstostazelomelssignadeitat	los confirmet ; sa passion peisons tostaz e lo mels signa deitat
.Alquesvos	. Alques vos
aideitderaizonqueJesusfezpospassion;tot	ai deit de raizon que Jesus fez pos passion ; tot
nolvosposceubencomptar,nolpodnulomdemadrenaz.Asosfidelsquarantadispermulzsemblanzsemonstretviu	nol vos posc eu ben comptar , nol pod nulom de madre naz . A sos fidels quaranta dis per mulz semblanz se monstret viu
;emsemblabelz	; emsembl  ab elz
becemanjed,deregnumDeusemper	bec e manjed , de regnum Deu semper
parlet.Eperesmundroalsallartozbabtizarintrinitad;quiluicredran,cilerentsalv;quinol	parlet . E per es mund roals allar toz babtizar in trinitad ; qui lui credran , cil erent salv ; qui nol
cretran,	cretran ,
serandamnat.Signesfaranlisoifidelqualselabanzfairesoleit.Linguesnoves	seran damnat . Signes faran li soi fidel quals el abanz faire soleit . Lingues noves
ilparlaranetdiablesencalceran.Sialcunsdelsbevenveren,nonauramal,zosabperver	il parlaran et diables encalceran . Si alcuns d  els beven veren , non aura mal , zo sab per ver
;sobraemalabdesmansmetranetsanitadatoz	; sobrae malabdes mans metran et sanitad a toz
rendran.SusenumontdonchesmontatqueHolivet	rendran . Sus en u mont donches montat que Holivet
numnatvosai.Levetsaman,silsbenedis;vengrelanuvols,silcollit.Elorvedent	numnat vos ai . Levet sa man , sils benedis ; vengre la nuvols , sil collit . E lor vedent
montetencel,addextrisDeuJesusesset;etquivenratozjudicar,atozrendra	montet en cel , addextris Deu Jesusesset ; etqui venra toz judicar , a toz rendra
ebenemal	e ben e mal
.Lisoifidelensontornet;aldezenjornjacumperveng,SpiritusSanctussobrelzched,	. Li soi fidel en son tornet ; al dezen jorn ja cum perveng , Spiritus Sanctus sobr  elz ched ,
silsenflametcumfugsardenz.Ildesabanzsuntaserad,deCrist	sils enflamet cum fugs ardenz . Il desabanz sunt aserad , de Crist
nonsabentmotparlar;enpaschevengvertuzdecel,ilnondobtennegunJudeu.Pertoz	non sabent mot parlar ; en pas che veng vertuz de cel , il non dobten negun Judeu . Per toz
lengatgesvanparlan,lasvirtuzCrist	lengatges van parlan , las virtuz Crist
vanannuncian;no	van annuncian ; no
lorpodomvius	lor pod om vius
contrastar,signesfazenperpodestad.Espandutsunt	contrastar , signes fazen per podestad . Espandut sunt
pertotcesmund,regnumDeinuncentpertot;pertot	per tot ces mund , regnum Dei nuncent per tot ; per tot
convertentpopletgent,ChristusJesuspertotabelz.LoSatanasdol	convertent popl  et gent , Christus Jesus per tot ab elz . Lo Satanas dol
enagrand,alsDeufidelsfaidursafanz.Alcanzencruz	en a grand , als Deu fidels fai durs afanz . Alcanz en cruz
failoslevar	fai los levar
,alquanzdespadesdegollar;ellos	, alquanz d  espades degollar ; ellos
alquanzfaiescorcer,alquanzenfogviustrebucher,etengradilielsfaitoster,alquanz	alquanz fai escorcer , alquanz en fog vius trebucher , et en gradiliels fai toster , alquanz
appetdreslapider.	appetdres lapider .
Luiqueaiude?Nulsvencera;cumpeislorfai	Lui que aiude ? Nuls vencera ; cum peis lor fai
,ilcreisentmais.LocapaCristesvegurad,pertotesmundesadhoraz.Noscestespugnesnonavem	, il creisent mais . Lo cap a Crist esvegurad , per tot es mund es adhoraz . Nos cestes pugnes non avem
,contranosepspugnardevem;fraindredevemnozvoluntez,	, contra nos eps pugnar devem ; fraindre devem noz voluntez ,
quepartaiamabDeufidels.Quarfinimunznonesmultlon,etregnumDeufortmentesprob;dontrenoslezfacam	que part aiam ab Deu fidels . Quar finimunz non es mult lon , et regnum Deu fortment es prob ; dontre nos lez facam
loben,gurpissem	lo ben , gurpissem
mundetsompechet.ChristusJesus,	mund et som pechet . Christus Jesus ,
quimansensus,mercetaiasdepechedors;en	qui mans ensus , mercet aias de pechedors ; en
talsraizonssiammespraes,pertapitadlomperdones.Teposcheretdraegraciaedavant	tals raizons si ammespraes , per ta pitad lom perdones . Te posche retdrae graciae davant
topairegloriae|SanzSpiritumposchelaudaretnuncpertotin	to paire gloriae | Sanz Spiritum posche laudar et nunc per tot in
secula.AMEN	secula . AMEN
DomineDeudevemps	Domine Deu devemps
lauder,Etasossanczhonorporter.Insuamorcantompsdelssanz,Quaeporluiaugrentgranzaanz;	lauder , Et a sos sancz honor porter . In su  amor cantomps dels sanz , Quae por lui augrent granz aanz ;
EtorestempsetsiestbiensQuaenoscantumpsdesantLethgier.	Et or es temps et si est biens Quae nos cantumps de sant Lethgier .
PrimesdidraivosdelshonorsQuaeilawretabduosseniors;ApresditraivosdelsaanzQue	Primes didrai vos dels honors Quae il awret ab duos seniors ; Apres ditrai vos dels aanz Que
lisuoscorpssustingsigranz,EtEwruins,cilDeumentiz,Que	li suos corps susting si granz , Et Ewruins , cil Deu mentiz , Que
luiagrandtormentoccist.Quantinfansfud,doncacielstemps,Alrei	lui a grand torment occist . Quant infans fud , donc a ciels temps , Al rei
loduistrentsoiparentQuidonc	lo duistrent soi parent Qui donc
regnevetacieldi:CiofudLothiers,filsBaldequi	regnevet a ciel di : Cio fud Lothiers , fils Baldequi
.Illenamat,Deulocovit,Rovatqueletresapresist.Didun,lebisquedePeitieus	. Il l  enamat , Deu lo covit , Rovat que letres apresist . Didun , l  ebisque de Peitieus
,LuilcomandatcielreisLothiers	, Luil comandat ciel reis Lothiers
.Illoreciut,tam	. Il lo reciut , tam
benenfist,Abumagistresemprelmist,QuilodoistbiendecielsavierDonDeuservirporbonafied	ben en fist , Ab u magistre semprel mist , Qui lo doist bien de ciel savier Don Deu servir por bona fied
.Etcumillautdoitdelcielart,Rendelquiluilocomandat.Illoreciu	. Et cum il l  aut doit del ciel  art , Rendel qui lui lo comandat . Il lo reciu
,bienlonodrit;Ciofudlonxtiempsobselosting.Deuslexaltatcuiel	, bien lo nodrit ; Cio fud lonx tiemps ob se los ting . Deus l  exaltat cui el
servid,De	servid , De
sanctMAXENZabbasdivint.NefudnulsomdelsonjuventQuimieldrefustdoncacielstiemps;Perfectusfudincaritet	sanct MAXENZ abbas divint . Ne fud nuls om del son juvent Qui mieldre fust donc a ciels tiemps ; Perfectus fud in caritet
,Fidautilgrandet	, Fid aut il grand et
veritiet,Etinraizonsbelsothsermons;Humilitietothpertrestoz.Ciosemprefudetjasier	veritiet , Et in raizons bels oth sermons ; Humilitiet oth per trestoz . Cio sempre fud et ja si er
:Quifailobien,laudazener;EtsanzLetgierssemprefudbons	: Qui fai lo bien , laudaz en er ; Et sanz Letgiers sempre fud bons
,Semprefistbienoqueelpod.	, Sempre fist bien o que el pod .
Davantloreienfudlaudiez;Cumillaudit,fulinamet.A	Davant lo rei en fud laudiez ; Cum il l  audit , fu lin amet . A
selmandatetciolidist:Acurtfust,sempreluiservist.Illexaltatelonorat,Sa	sel mandat et cio li dist : A curt fust , sempre lui servist . Il l  exaltat e l  onorat , Sa
gratialiperdonat,EthunctambienqueilenfistDeHostedunevesqueenfist.	gratia li perdonat , Et hunc tam bien que il en fist De Hostedun evesque en fist .
Quandiusvisquetciel	Quandius visquet ciel
reisLothiers,BienhonorezfudsanczLethgiers.Ilsefudmorz,damzifudgranz.Ciocontroverent	reis Lothiers , Bien honorez fud sancz Lethgiers . Il se fud morz , damz i fud granz . Cio controverent
baronfranc,Por	baron franc , Por
cioquefuddebonafiet,DeChielperigfesissentrei.Uncompteioth,pres	cio que fud de bona fiet , De Chielperig fesissent rei . Un compte i oth , pres
enlestrit;CielepsnumauretEvrui.NevolreciwreChielperin,MaisloseufredreTheoiri.	en l  estrit ; Ciel eps num auret Evrui . Ne vol reciwre Chielperin , Mais lo seu fredre Theoiri .
Nelcondignetnulsdesospiers,Reivoluntfairestresogred.Illopresdrenttuitaconseil	Nel condignet nuls de sos piers , Rei volunt fair  estre so gred . Il lo presdrent tuit a conseil
,Estresogretenfisdrenrei	, Estre so gret en fisdren rei
;EtEwruinsotengrandol,Porroqueventrenolsenpoth.Por	; Et Ewruins ot en gran dol , Porro que ventre nols en poth . Por
cieltielduolrovasclergier,Sisenintrat	ciel tiel duol rovas clergier , Si s  en intrat
inunmonstier.ReisChielpericstambienenfist,DesanctLethgierconsilierfist.Quandiusalsuo	in un monstier . Reis Chielperics tam bien en fist , De sanct Lethgier consilier fist . Quandius al suo
consieledrat,IncontraDeubensigarda,Leiconsentitetobservat,Etsonregnetbendominat.Ja	consiel edrat , Incontra Deu ben si garda , Lei consentit et observat , Et son regnet ben dominat . Ja
fudtelsom,Deuinimix,QuilencusatabChielpering.L	fud tels om , Deu inimix , Qui l  encusat ab Chielpering . L 
irafudgranzcumdesenior,Etsancz	ira fud granz cum de senior , Et sancz
Lethgiersocsentpavor;Jalosotbien,illocelat	Lethgiers oc s  ent pavor ; Ja lo sot bien , il lo celat
,Anuilomnenoldemonstrat.Quantcieliraetelsesdevent,Paschasfurentin	, A nuil omne nol demonstrat . Quant ciel  irae tels esdevent , Paschas furent in
epsceldi;	eps cel di ;
EtsanczLethgiers	Et sancz Lethgiers
fistsonmistier	fist son mistier
,Missaecantat,fistlo	, Missae cantat , fist lo
mulben.Pobletloreicommuniet,Etsenscumgietsi	mul ben . Pobl  et lo rei communiet , Et sens cumgiet si
senralet.ReisChielperics,cumillaudit,Presdrasosmeis,aluistramist;	s  en ralet . Reis Chielperics , cum il l  audit , Presdra sos meis , a luis tramist ;
Ciolimandatquerevenist,Sagratiaportotouist.EtsanczLethgiersnes	Cio li mandat que revenist , Sa gratia por tot ouist . Et sancz Lethgiers nes
sothmesfait;Cumvitles	soth mesfait ; Cum vit les
meis,aluiralat.Ilciolidistetadunat:"Tosconsiliersjanonestrai.Meuevesquet	meis , a lui ralat . Il cio li dist et adunat :" Tos consiliers ja non estrai . Meu  evesquet
nemleztenerPortequisempremvolsaver	nem lez tener Por te qui semprem vols aver
.Enumonstiermelaisseintrer.Posci	. En u monstier me laisse intrer . Pos ci
nonposc,laivolester."Envizlofist,nonvoluntiers,Laissel	non posc , lai vol ester ." Enviz lo fist , non voluntiers , Laisse l
intrarinumonstier.CiofudLusosutilintrat;ClerjEwruiillotrovat.CilEwruinsmoltli	 intrar in u monstier . Cio fud Lusos ut il intrat ; Clerj  Ewrui illo trovat . Cil Ewruins molt li
volmiel,	vol miel ,
Tothperenveia,nonperel.EtsanczLethgiersfistsomistier,Ewruipristacastier:	Toth per enveia , non per el . Et sancz Lethgiers fist so mistier , Ewrui prist a castier :
Cieliragrandetcielcorropt,Ciolipreia,laissaslototh.FusliporDeu,	Ciel  ira grand et ciel corropt , Cio li preia , laissas lo toth . Fus li por Deu ,
nelfusporlui.Ciolipreia,paiassablui.EtEwruins	nel fus por lui . Cio li preia , paias s  ab lui . Et Ewruins
fistfinctapais;Cioldemonstrat	fist fincta pais ; Ciol demonstrat
,quesipaias.Quandiusincielmonstier	, que si paias . Quandius in ciel monstier
instud,Cioldemonstrat,amixlifust.Maisenavantvoscioaurez,Cumilledratpormalafid.	instud , Ciol demonstrat , amix li fust . Mais en avant vos cio aurez , Cum ill edrat por mala fid .
RexChielperingsilsefudmorz;Porloregnetlosowrenttost.Vindrentparenteloramic,	Rex Chielperings il se fud morz ; Por lo regnet lo sowrent tost . Vindrent parent e lor amic ,
LisanctLethgier	Li sanct Lethgier
,liEwrui.Cioconfortentadambesduos,Quesentralgentinlorhonors.EtsanczLethgiersdenfistdra	, li Ewrui . Cio confortent ad ambes duos , Que s  ent ralgent in lor honors . Et sancz Lethgiers den fistdra
bien,Quaesenralaten	bien , Quae s  en ralat en
sevesquet.EtEwruinsdenfisdramiel,Quaedoncdevenganatemaz.Sonquevqueilacoronat,Tothlo	s  evesquet . Et Ewruins den fisdra miel , Quae donc deveng anatemaz . Son quev que il a coronat , Toth lo
laiserarecimer.DomineDeuillolaissat,Et	laisera recimer . Domine Deu il lo laissat , Et
adiables	a diables
comandat.Quidoncfudmielsetaluivint,Ilvoluntierssemperreciut	comandat . Qui donc fud miels et a lui vint , Il voluntiers semper reciut
.Cumfulcenautgrandadunat,Loregneprest	. Cum fulc en aut grand adunat , Lo regne prest
adevastar.Afoc,aflammavaiardant,Etagladiespercutan.Porquantilpot,tan	a devastar . A foc , a flamma vai ardant , Et a gladies percutan . Por quant il pot , tan
